name,website,companyLogo,description,funding,founded,headquarteredIn,geographicalFocus,typeOfWork,category,requiresDigitalAudience,applicationRequired,remoteWork,minimumAge,equipmentQualSkills,requirements,averageEarnings,timeToFirstDollar,numPeopleMakingMoney,profitModel,profitModelDescription,platformPricing,affiliateLink,founderMessage,founderName,founderTwitter,email,Notes,Signup Link
onPodio,onpodio.com,onPodio Logo (blue text & transparent).png (https://dl.airtable.com/.attachments/c9e1cecc8558d2ddb5f9bcf994bae50e/e42ec285/onPodioLogobluetexttransparent.png),"Build your own scalable fitness instruction business. You will have all the digital tools needed to create a custom website + automate their class bookings, payments, memberships, class packs, on-demand content, and more.",Bootstrapped,2019,,,Fitness Instructor,SMB (creation of a business),Yes,No,Yes,,"Computer (with internet connection),Smartphone (with data)","Equipment as necessary for teaching fitness classes (e.g. yoga mat, weights)",,,250,Other,,Customers pay a 49c + 3% booking fee.,,"onPodio is empowering ANY fitness instructor to be a successful entrepreneur by eliminating the technology barrier and giving instructors the digital tools they need to start, run and grow their own scalable business",Kal Jamshidi,,kal@onpodio.com,,
Comonetize,https://www.comonetize.me/,COMO_HAT (2).png (https://dl.airtable.com/.attachments/ee377a3ce1d86193bc35709540a3aa81/db9088a3/COMO_HAT2.png),"A monetization tool that empowers community leaders to move to the next level and turn their communities into professional, profitable businesses. You can create a branded website- with a directory of community members and a job/project board- to offer to community members.",Bootstrapped,2019,,,Community Leader,SMB (creation of a business),Yes,No,Yes,,Computer (with internet connection),An active and vivid community of professionals or businesses usually works best,2000,,,Other,,"Start free, 9$ per 400 registered users, platform fees.",,"About ten years ago, I launched a local marketplace of talents with a unique business model, which has been my main and stable income channel ever since. I fought on this battlefield, bringing my own community from zero to 100K members, and with this experience, I've created Comonetize, a platform for community leaders to do what I did - make money and turn their communities into profitable businesses while giving huge value to their community members. We're here to help you every step of the way",Gali Meiri,https://twitter.com/galimeiri,gali@comonetize.me,,
Rev,www.rev.com,Rev Logo.jpg (https://dl.airtable.com/.attachments/78bb66cf67e7fc23e83f9dd1063b59f2/fa5d2091/RevLogo.jpg),"Transcribe audio to text, caption video content, and subtitle English content with foreign languages.",$35M,2011,,,Tasks and Services,Gig (work on your time),No,Yes,Yes,,"Computer (with internet connection), Native English",Translation skills,245,,50000,Free,,,,,,,,,
Eventbrite,www.eventbrite.com,logo-wordmark-orange.png (https://dl.airtable.com/.attachments/fbd03ba2087f8634afa8ece88b01950a/0e5b90ac/logo-wordmark-orange.png),"Grow and cultivate your community while building your events businesses through Eventbrite — a global self-service ticketing platform. The platform supports both virtual and in-person events, providing creators with one home base for managing their program of events.",Public Company,2006,,,Event Organizer,SMB (creation of a business),Yes,No,Yes,,Computer (with internet connection),Ability to host live or virtual events,,,949000,Other,,Essentials pricing is 2% + $0.79 per paid ticket & Professional pricing is 3.5% + $1.59 per paid ticket. Both packages are always free for free tickets.,,,,,tamara@eventbrite.com,,
ScrollStack,https://scrollstack.com/signup,B39BE988-1EF7-4A74-A58E-F448DF1738F1.png (https://dl.airtable.com/.attachments/0b459e29a7b15e82ec2502598bb94d6e/d0af71ac/B39BE988-1EF7-4A74-A58E-F448DF1738F1.png),"Publish your writing, videos, and audio, and charge your followers for posts they are willing to pay for in less than a minute.",Bootstrapped,2020,,,"Content Creator, Writer",SMB (creation of a business),Yes,No,Yes,13,"Computer (with internet connection),Smartphone (with data)",,,,,Free,,,,"Scrollstack is a marketplace for creators to post articles, podcasts, photos, and videos. Whether free or charged and anywhere in the world, we've designed our platform to be a mobile-first and multilingual experience for creators and their fans. Our goal is to payment-enable every creator who wants to charge for their work in the way they want to charge for it. We have a widely recognized brand among creators and discerning audiences with a monthly reach of 10 MM",Samir Patil,https://twitter.com/samirpatil,samir@scrollstack.com,,
Airschool,airschool.com,logo.png (https://dl.airtable.com/.attachments/17fe0dc48b089b9159d15d1a1fcf33b2/80a08490/logo.png),"Airschool makes it simple for experts to create, sell and scale courses, build an audience and make money.",Bootstrapped,2020,,,"Video Course Creator, Content Creator",SMB (creation of a business),No,No,Yes,,no comp?,"Knowledge that can be turned into a course, video creating skills",500-5000,,100,Percentage Take Rate,20,,,"Experts and learners are joining Airschool for the content but are staying for the community of it. Each course batch has online meetups, networking events and office hours with experts. Learners from 35 different countries have taken our courses — we are just getting started",Fatima Rizwan,https://twitter.com/fatimarizwan,fatima@airschool.com,,
Vurbl,https://vurbl.com/,vurbl_vertical_logo.png (https://dl.airtable.com/.attachments/edf9ed1666153e3348ad7a4fab133c95/a0b65781/vurbl_vertical_logo.png),"Audio creators of all stripes will find a new home on Vurbl. Claim your podcast station via RSS feed, upload the audio from your YouTube Channel's videos or upload natively to host your audio for free. You will need to build an audience to earn podcast ad revenue.",$1.3M,2020,,,Podcaster,SMB (creation of a business),Yes,No,Yes,13,"Computer (with internet connection), Microphone",Audio editing tools,,,,Free,,,,,,,paul@vurbl.com,,
Podcast Rental,https://www.podcastrental.com/,podcast rental logo.png (https://dl.airtable.com/.attachments/d9a3c205d33dd73f9baad6d048a1ce0a/9efe4f98/podcastrentallogo.png),Earn revenue by listing your own podcast studio/recording space for people to discover,Bootstrapped,2019,,,Rentals,SMB (creation of a business),No,Yes,Yes,,,A podcasting / recording studio to rent out,,,,Percentage Take Rate,,Monthly listing fee,,,,,paul@podcastrental.com,,
Off Script,offscript.io,offscript_black.png (https://dl.airtable.com/.attachments/c5e342cd59da67b8c3442b6670b8f08c/299c5d9e/offscript_black.png),"Off Script is the best way for creators to set up their very own multibrand e-commerce, sell products they love from amazing DTC-brands, and help their community find new favorites.",Bootstrapped,2020,"Stockholm, Sweden",Europe,Ecommerce,SMB (creation of a business),Yes,No,Yes,,Smartphone (with data),,,,,Free,,,,,,,pontus@offscript.io,Creators paid up to 18% commission on sales,
iFans,https://ifans.com,Final-iFans-Logo.png (https://dl.airtable.com/.attachments/101b017dbc348ae21ec284fb55bb40c9/ffaabe23/Final-iFans-Logo.png),"With iFans, you can monetize not only your audience, but your Network with premium content, 1-on-1 interactions, live video streams, and more.",$0.6M,2020,,,"Content Creator, Adult Content Creator",SMB (creation of a business),Yes,No,Yes,18,"Computer (with internet connection),Smartphone (with data)",,20000,,400,Percentage Take Rate,20,,,,,,simon@ifans.com,,
Service Connection,https://serviceconnection.pro/,Hex SC.jpg (https://dl.airtable.com/.attachments/e4b1f64ecb8438a8d6554aa86bd09742/2cb26423/HexSC.jpg),"Select your skill sets from a wide range of available services such as assembly, delivery, home improvement, installation, repair, smart home, and more. Get paid the same day for completed services!",Bootstrapped,2020,,,Tasks and Services,Gig (work on your time),No,Yes,No,18,"Computer (with internet connection),Smartphone (with data),Backgrouind Check","Valid social security number or business, verifiable proficiency in your chosen skill sets, transportation applicable to services you offer ",45/hour,,,Free,,,,,,,trent@serviceconnection.pro,,
LokaFit,lokafit.com,android-chrome-192x192.png (https://dl.airtable.com/.attachments/ef66a9de3c12aacc22df7564d276df3b/013d3caf/android-chrome-192x192.png),"Host your virtual fitness studio on a platform founded by and for yoga and fitness instructors. Give clients one place to view, register, pay for, and attend your live or on-demand classes!",Bootstrapped,2020,,,"Fitness Instructor, Video Content Creator",SMB (creation of a business),Yes,Yes,Yes,,"Computer (with internet connection),Smartphone (with data)",Fitness instruction skills,500,,20,Percentage Take Rate,20,,,"Our mission is to give teachers the tools to build their virtual business and connect with students in an authentic way. By providing teachers with an easy and integrated platform to host custom content, we help them build trust and connection with their students","Addie Wales, Max Lund",,addie.wales@lokafit.com,,
1v1Me,1v1meapp.com,Group 54.png (https://dl.airtable.com/.attachments/c027d2d10e30252e84f1a6ff1c850aca/0ede8b9a/Group54.png),Play video games for money against other people. Tap into a growing community of gamers or wager with friends on your favorite games like Call of Duty and Fortnite.,$0.75M,2020,,,Gamer,SMB (creation of a business),No,Yes,Yes,18,Computer (with internet connection),Technologies to play specific games,,,,Free,,,,"1v1Me is the best way to make a living from eSports and go pro, starting with being able to play your favorite games for money. Making a living from eSports is almost impossible, and we plan to bridge the gap long term with several different monetization opportunities for gamers. Not only is 1v1Me philosophically aligned with this mission, but our business model also is. Typically, companies in this space will charge 10-20% and take more money away from gamers. Our app is free to use and we take no fees for gamers to compete",Anthony Geranio,https://twitter.com/anthonygeranio,anthony@1v1meapp.com,,
IndiFit,www.indifit.co,IndiFit_1008x240_transparent.png (https://dl.airtable.com/.attachments/27549283ab073ecb87a02d03bdc420d5/c8af887b/IndiFit_1008x240_transparent.png),Business management tools for independent fitness instructors with the support of real humans who care. Power your business with lightning-fast booking from your link in bio or integrate IndiFit into your own website!,$0.15M,2020,,,Fitness Instructor,SMB (creation of a business),Yes,No,Yes,,"Computer (with internet connection),Smartphone (with data)",Fitness instruction skills,,,,Percentage Take Rate,5,,,"We created IndiFit because we believe that fitness instructors deserve more - more than teaching a packed room of students for $25 per class, more than navigating an entrepreneurial journey alone, and more than one-size-fits-all booking tools. We believe that our partners deserve technology built exclusively for fitness entrepreneurs, full ownership of their clients, and 24/7 support from real humans. We're honored to support hundreds of instructors on their entrepreneurial journeys!","Cheryl Kemp, Scott Harris, Adam Tichauer",,cheryl@indifit.co,,
Subport,http://subport.us,subport app icon.png (https://dl.airtable.com/.attachments/fbedc5e10501c86dd5022b47dd0d7084/45f9374b/subportappicon.png),"Create your own subscription app. Customers can subscribe to your membership via your own app and redeem contactless in shop or order ahead. SubPort focuses mostly on independent businesses such as cafes, barbers, chefs, landcaping, and car wash businesses.",Bootstrapped,2020,,,"Chef, Ecommerce, Tasks and Services",SMB (creation of a business),Yes,No,Yes,,Smartphone (with data),"Knowing how to provide your service (making a dish, providing a service).  ",1500,,20,Subscription Fee,40,,,,,,team@subport.us,,
Dabble,http://dabble.co,Dabble Logo.png (https://dl.airtable.com/.attachments/b7badc396560d14639e169c2793d6dd4/9a2a439d/DabbleLogo.png),"Host unique, local experiences, classes, and events. Dabble makes it easy to share your skills and passion to connect to our learning community.",$2.4M,2011,,,Event Organizer,SMB (creation of a business),Yes,No,Yes,13,"Computer (with internet connection),Smartphone (with data)",,400,,5200,Other,,5% fee for any referred bookings. 15% flat fee for tickets sold by Dabble,,,,,hello@dabble.co,,
Fanhouse,https://fanhouse.app,fanhouse-grad-pink.png (https://dl.airtable.com/.attachments/a51f72941303a19eb9f5334a7123c6ea/26d75fe9/fanhouse-grad-pink.png),"Offer a subscription for your Finsta-like content. Post shower thoughts, felt-cute-might-delete-later selfies, and sh*tposts. Connect directly with your fans and earn money by growing your exclusive, authentic community.",Bootstrapped,2020,,,Content Creator,SMB (creation of a business),Yes,No,Yes,,Smartphone (with data),A magnetic personality,500,,100,Percentage Take Rate,10,,,"Fanhouse is a platform that helps the average creator make money for their platform — imagine posting about your life on a finsta or private alt, but with a paywall and monetization features such as tipping and locked messages. Unlike existing platforms that are geared towards creators with specific skills, such as artists on Patreon or adult content creators on OnlyFans, content creators on Fanhouse can post just about anything, from their casual selfies to their shower thoughts, and be supported by fans who want to see real, personal content",Jasmine Rice,https://twitter.com/jasminericegirl,hello@fanhouse.app,,
AspireIQ,www.aspireiq.com,,"Get paid to create content on your terms and work with the right brands that can promote you and help grow your audience. Browse through hundreds of brands looking for influencers and creators, and discover new brands every week.",$22M,2014,,,Content Creator,SMB (creation of a business),Yes,No,Yes,18,"Computer (with internet connection),Smartphone (with data)",,400,,50000,Free,,,,"Aspire is a platform built for brands and their communities. With over 6M creators and 500 brands working together to create visual and written content, Aspire is the largest platform in the world for creators to find brand sponsorships. Aspire helps brands partner with individuals who inspire them to fuel their growth, while empowering creators to earn a living doing what they love — co-creating with their favorite brands",Anand Kishore,https://twitter.com/anandkishore?lang=en,ak@aspireiq.com,,
Trend,trend.io,Trend_Logo (1).png (https://dl.airtable.com/.attachments/c35a30ba4c6346bdd4f09e5590908352/974e5a9f/Trend_Logo1.png),Generate UGC images or videos for e-commerce brands.,$0.7M,2018,,,Content Creator,Gig (work on your time),Yes,Yes,Yes,18,Smartphone (with data),,500,,500,Free,,,,,,,ramon@trend.io,,
LitterRater,www.litterrater.com,9C4F1B2B-1B9A-421B-86F8-F185896CBDB5.png (https://dl.airtable.com/.attachments/fffd32d22f94603ba9bc16e6f1628059/1abe5b57/9C4F1B2B-1B9A-421B-86F8-F185896CBDB5.png),Join a web-based incentive program rewarding folks who report and clean litter in their community! Earn points by reporting or cleaning litter and cash in the points for incentives,Bootstrapped,2017,,,Tasks and Services,Gig (work on your time),No,No,No,,"Computer (with internet connection),Smartphone (with data)",,250,,300,Free,,,,,,,ladson.fishburne@gmail.com,,
FLATLAY,https://flatlay.io/creatives,flatlay_text_gray-2.pdf (https://dl.airtable.com/.attachments/a8af33a9e30cb8761994634e60bb0b5d/c67425d4/flatlay_text_gray-2.pdf),Flatlay is a platfrom that enables you to start a digital storefront for affiliate products in seconds!,$1M,2017,,,Ecommerce,SMB (creation of a business),Yes,No,Yes,,Smartphone (with data),,750,,20000,Free,,,,"Flatlay is the end to end social commerce automation platform for brands, creatives & customers. The platform provides publishing tools to any creatives looking to start a digital storefront in seconds with their content while empowering brands and retailers with a portal to activate their community. The social marketplace identifies & activates customer advocacy through a Content Loyalty Program to drive brand storytelling for more than +1k brands & retailers today",Ali Sammour,,support@theflatlay.com,,
airsubs,airsubs.com,airaubs.png (https://dl.airtable.com/.attachments/12908baec5f73812bcd5a90b38f31e99/0945c437/airaubs.png),"Earn money teaching what you love and instantly launch a beautiful virtual studio for your classes: cooking, Yoga, fitness, meditation, more. Sell live classes and make money while you sleep with on-demand video content, lock in recurring income with memberships, offer private classes, put marketing on autopilot, and grow your brand!",$2.5M,2020,,,"Fitness Instructor,Video Course Creator,Event Organizer",SMB (creation of a business),Yes,Yes,Yes,,"Computer (with internet connection),Smartphone (with data)",Zoom account,,,,Other,,"Starter: $0 per month + 8%, Pro: $25 + 3%, Premier: $50 + 2%, Unlimited: $100 + 1%",,,,,tomas@airsubs.com,,
PICKL,https://pickl.xyz/shopper,691BEEC2-60CA-4ABA-A46B-139532866046.png (https://dl.airtable.com/.attachments/a17bd9897cd66404750f025535ba7a12/2d00a174/691BEEC2-60CA-4ABA-A46B-139532866046.png),Take pictures and answer simple questions about brands at grocery stores. Each competed task pays $5 with same-day cash-out.,$0.2M,2020,,,Tasks and Services,Gig (work on your time),No,No,No,,Smartphone (with data),Transportation,500,,5000,Free,,,,,,,tania@steamwork.net,,
CV Knights,www.cvknights.com,logo + name.png (https://dl.airtable.com/.attachments/ee0554320b59532bc358abc716083bde/46d9db8e/logoname.png),Assist candidates to boost their CV. Share your expert knowledge tailored to your own industry to make money providing advice.,Bootstrapped,2020,"London, England","North America, Europe","Writer, Tasks and Services",Freelance / project-based work,No,Yes,Yes,,"Computer (with internet connection), Bachelors Degree, Native English","Experience in the UK market is ideal, but not necessary",300,,150,Percentage Take Rate,10,,,,,,alejandro.mateo@cvknights.com,,
Songfinch,songfinch.com,A91F6F31-C622-444E-AD50-596FEA15D366.jpeg (https://dl.airtable.com/.attachments/cf911263203ecca5853b8139786f66f3/dc1af3f5/A91F6F31-C622-444E-AD50-596FEA15D366.jpeg),Write and perform personalized songs.,$4.0M,2017,,,"Audio Content Creator, Ecommerce",SMB (creation of a business),No,Yes,Yes,18,Computer (with internet connection),"Strong songwriter, vocals and ability to record and produce studio quality music",1500,,415,Percentage Take Rate,50,,,,,,rob@songfinch.com,,
TipSnaps,www.tipsnaps.com,blue logo.png (https://dl.airtable.com/.attachments/4342ad330b5b5e3219d85e3f5c360602/69e94c4e/bluelogo.png),A social media marketplace where anyone with a following can directly monetize their fanbase can share and sell exclusive content to their Loyal followers (Tippers). An adult-friendly but not adult-first platform.,Bootstrapped,2005,,,"Content Creator, Adult Content Creator",Creator (monetize audience and fans),Yes,No,Yes,18,"Computer (with internet connection),Smartphone (with data)",,500,,2500,Percentage Take Rate,15,,,"Since launch we have processed and paid out ~$2M for creators. We have 420k registered users, 8.5M unique visitors to the site and served up over 50M pageviews. We're very excited about 2020 and the future of the creator economy. Many of our users are looking for an alternative, less adult centric version of Onlyfans — that is what TipSnaps is!",Lyonel Dougé,https://twitter.com/lyoneldouge,ldouge@tipsnaps.com,,
ShareGrid,https://www.sharegrid.com/,sharegrid.png (https://dl.airtable.com/.attachments/f59fcbc4b0f078c525f7aea437c6d93c/c5353347/sharegrid.png),"Join the largest creative marketplace for filmmakers, photographers, and creators. Whether you have video/photo gear or a location to rent out, or want to put your creative skills out for hire, ShareGrid is the place to do it!",$1.4M,2014,,,"Rentals, Content Creator",SMB (creation of a business),No,No,Yes,18,"Computer (with internet connection),Smartphone (with data)",Ownership of photo/video gear or locations to rent out,430,,6675,Other,,"15% for gear rentals, 5% for gear sales",,We built ShareGrid to give artists freedom. To give them access to the tools they need and the financial freedom they desire in order to focus on their craft,Arash Shiva,https://twitter.com/ashiva,ashiva@sharegrid.com,,
Loopie,www.loopie.us,"Loopie Logo.png (https://dl.airtable.com/.attachments/5b50a6c968df265256f4cb3ebf798e2c/35731ffb/LoopieLogo.png),Loopie Icon.png (https://dl.airtable.com/.attachments/40ae9182902e59140c5bc92a743e00d0/3d07d8fe/LoopieIcon.png)","Certified Loopie Washers can earn money from the comfort of home using their in-unit washer and dryer to wash, dry, fold & package Loopie customers' laundry. Loopsters are provided with all the materials necessary to complete any Loopie order (detergent, dryer sheets, lint rollers, gloves, etc) and are paid on a per bag basis",$1M,2018,"Seattle, WA ",North America,Tasks and Services,Gig (work on your time),No,No,Yes,,"Smartphone (with data), Bank Account",In-unit washer and dryer,500,,20,Free,,,,,,,luke@loopie.io,Paid per bag,
Upcall,https://www.upcall.com/en/caller,,Get paid to make outbound phone calls for 400+ companies from home. ,$2M,2016,"San Francisco, CA",North America,Salesperson,Gig (work on your time),No,Yes,Yes,,Computer (with internet connection),Microphone,3500,,50,Other,,Upcall takes a small percentage of the bonuses made by Upcallers,,,,,michael@upcall.com,,
Launch Cart,https://launchcart.com,LaunchCart -01-01-01.png (https://dl.airtable.com/.attachments/960798633f34903bdf514b6cf0bdaab7/da9b7fdb/LaunchCart-01-01-01.png),"We make it dead simple to build start an e-commerce business with merch (tee's, hoodies, hats, etc 300+ products) with no upfront costs and no monthly fees.",$400k,2019,Escondido California,Worldwide,Ecommerce,SMB (creation of a business),No,No,Yes,,Computer (with internet connection),Product to sell,,,1100,Other,,3% platform fee & merchant fee (this is typically around 2.9% + .30 cents per transaction) OR $97/mo + 0% platform fee.,,"We have created the best and easiest platform on the net to create a ""merch"" stores for influencers, entrepreneurs and small business owners.  People are leaving Shopify daily to use Launch Cart because it is so simple and there are NO monthly fees!  Many are also earning over $100 per hour building stores for others!  We have amazing training and a sellers community to help you if you get stuck!",Greg Writer,,ceo@launchcart.com,,
Rally Network,www.rally.io,Rally_Name_Logo.png (https://dl.airtable.com/.attachments/6206e7c14268faab59ca6c91e227b03c/089fa65b/Rally_Name_Logo.png),Create your own cryptocurrency token to enable you to tokenize your digital brand and services.,$10M,2018,San Francisco,"North America, Europe, Australia","Content Creator,Gamer,Livestreamer",Creator (monetize audience and fans),Yes,Yes,No,,Computer (with internet connection),Light familiarity and willingness to learn cryptocurrency economics.,2000,,43,Free,,,,"Imagine being able to gamify your digital brand, provide new ways for your fans to engage you, and earn cryptocurrency that you can turn into real money to fund creating more content. With Rally, you create your very own cryptocurrency that you own 100%. Rally doesn't require any coding— our engineering team abstracts away all the complexity. Crypto is no longer cryptic with Rally. If you're crypto curious and looking to work with a serious crypto team focused on Content Creator monetary success, come check out our vibrant community on Discord and create your very own cryptocurrency today!",Kevin Chou,https://twitter.com/KevinChou,kchou@rally.io,Requires community approval,
Reach.Live,https://reach.live/,small-logo-dark-square copy.png (https://dl.airtable.com/.attachments/d02f49c068e7fe227d28c71f90e0e7ab/46203cf4/small-logo-dark-squarecopy.png),Host events and shows by sharing your skills and make a business out of it with an all in one platform,$0.15M,2020,Mountain View,"North America, Europe, Australia",Event Organizer,Creator (monetize audience and fans),Yes,No,Yes,,"Computer (with internet connection),Bank Account",,,,,Percentage Take Rate,10,,,,,,akarsh@reach.live,,
influence.co,influence.co,influence_icon.png (https://dl.airtable.com/.attachments/e4fde91f6afe6a4289245e961c369ab1/cb46576f/influence_icon.png),"Professional network for influencers, creators and the brands that work with them. Get paid to collaborate and create content for over 75K brands.",$4.5M,2016,Los Angeles,Worldwide,Content Creator,Creator (monetize audience and fans),Yes,No,Yes,,Computer (with internet connection),,,,50000,Free,,,,"We connect influencers, creators, and the professionals who work with them through inspiring content, supportive community, and collaborative commerce enabling everyone to pursue their passion and grow their business.",Niel Robertson,https://twitter.com/nielr1,nielr@influence.co,,
