name,website,companyLogo,description,funding,founded,headquarteredIn,geographicalFocus,typeOfWork,category,requiresDigitalAudience,applicationRequired,remoteWork,minimumAge,equipmentQualSkills,requirements,averageEarnings,timeToFirstDollar,numPeopleMakingMoney,profitModel,profitModelDescription,platformPricing,affiliateLink,founderMessage,founderName,founderTwitter,email,Notes,Signup Link
Trusty Oak,www.trustyoak.com,Logo.jpg (https://dl.airtable.com/.attachments/50447b86210511986da7eea203f71fc6/88ac299e/Logo.jpg),"Turn your marketing, task management, and other skills into a lucrative opportunity by becoming a Virtual Assistant on Trusty Oak — the main point of contact with clients and freelance professionals!",$0.5M,2015,"Austin, TX",North America,"Tasks and Services,Writer",Gig (work on your time),No,Yes,Yes,,"Computer (with internet connection),Smartphone (with data)","Permanent residence in the United States,At least two years of experience as an executive assistant, project manager, office manager or similar role
",3200,,40,Subscription Fee,29,,,"Trusty Oak was founded in 2015 to support driven people achieving big dreams. We exist first to serve an exclusive, collaborative community of the country’s top freelance virtual assistants by providing coaching and mentoring services, resources, and legitimate opportunities to be hired by their ideal clients.
",Amber Gray,https://twitter.com/ambergrayatx,sarah.olson@trustyoak.com,,
Onsite.fun,https://onsite.fun/,Frame 21.png (https://dl.airtable.com/.attachments/c97bc05fb1693591fd8fab8053bf563e/547cf2a7/Frame21.png),Offer teams and organization an interactive experience while you monetize your expertise and passion.,Bootstrapped,2020,Barcelona (Spain),Worldwide,Event Organizer,Creator (monetize audience and fans),No,Yes,Yes,,Computer (with internet connection),Material for the activity if applicable,2000,,4,Percentage Take Rate,20,,,At Onsite.fun we empower talented individuals to turn their passions into a profit via curated corporate experiences.,Joan Alavedra,https://twitter.com/joalavedra,jaume@onsite.fun,,
Flurly,https://flurly.com,logo.jpg (https://dl.airtable.com/.attachments/b36db223a5df3fc21240b7d0d618a1bb/e6e92406/logo.jpg),Flurly is a platform that allows you to sell any digital product and keep 99% of what you make after payment processing fees.,Bootstrapped,2020,Bay Area,North America,Ecommerce,SMB (creation of a business),No,No,Yes,,Computer (with internet connection),Digital product to sell,150,,7500,Percentage Take Rate,1,,,Flurly is the most affordable way to sell digital products online. Sell any digital product in under a minute and keep 99% of what you make after payment processing fees. No monthly fees either.,JR,https://twitter.com/thebuilderjr,hi@flurly.com,,
Collabstr,collabstr.com,logoFormatted.png (https://dl.airtable.com/.attachments/8345b0d4a40ad72cbf2e53c6e91a594b/d5d8827b/logoFormatted.png),"Find more brand deals by listing your TikTok & Instagram services on Collabstr, a public marketplace where your profile will be shown to brands that are most interested in working with you.",Bootstrapped,2020,"Vancouver, BC",North America,Content Creator,Creator (monetize audience and fans),Yes,No,Yes,,Computer (with internet connection),Must have an Instagram or TikTok account with organic growth/engagement,500,,1250,Percentage Take Rate,15,,,,,,kyle@collabstr.com,,
Markk Inc.,http://www.getmarkk.com,logo - wordmarkk.jpg (https://dl.airtable.com/.attachments/7c4482c32d31a968a49493af5f2946a7/726a0c17/logo-wordmarkk.jpg),Make money by sharing photos and short videos from the places you visit every day.,$2M,2019,Los Angeles,North America,Content Creator,Gig (work on your time),No,No,No,,Smartphone (with data),,150,,102,Free,,,,"Markk is an app for everyone to share real-time photos and videos from places, and earn money from EVERY post. In the last 6 months, our top 100 users have 'Markked' over 25K places and earned $10K in the process! They have also helped the community see what places are open, open for dine-in, socially-distanced etc. You don't need to create great videos, have editing skills, or have an existing audience — rate places, add stickers, Markk your world in real-time, earn money, and help your community",Sunil Mohan,https://www.linkedin.com/in/sunilmohan/,sunil@markk.app,,
Circletime Interactive,www.circletimefun.com,Circletime Logo - Square-black-transparent-ForLightBackground.png (https://dl.airtable.com/.attachments/7b9e8a63a5d6da5e5e5041eade5e1824/abebb1b4/CircletimeLogo-Square-black-transparent-ForLightBackground.png),"Turn your passion for nurturing creativity and sharing knowledge with kids into a virtual, interactive learning experience. ",Bootstrapped,2018,"New York, NY",Worldwide,"Teacher,Community Leader,Content Creator",Freelance / project-based work,No,Yes,Yes,,Computer (with internet connection),"We are looking for experienced teachers (online and offline) or subject-matter experts who believe in active, experiential and play-based learning. Montessori programs and experience a huge plus. Foreign language skills welcome. ",$50/hour,,20,,,,,"We are on a mission to provide teachers a dignified gig economy space as content creators. We provide support, professional development, community and growth opportunities. Our core audience is early childhood + young kids currently, but we are broadening at a rapid pace. ",Tatiana Feldman,https://twitter.com/itstatianafeld1,tfeldman@circletimefun.com,,
Hecto,https://hecto.io,hforhecto.jpg (https://dl.airtable.com/.attachments/5e51041eac8412a4b44f4e5df12d51ba/a8830efb/hforhecto.jpg),"Hecto is newsletter sponsorships, simplified. Newsletter owners big and small can find businesses that want to sponsor their newsletters and vice versa!",Bootstrapped,2020,UK,Worldwide,Content Creator,Creator (monetize audience and fans),Yes,No,Yes,,Computer (with internet connection),"Stripe account, Newsletter",,,30,Percentage Take Rate,10,,,"Hecto is an independent, bootstrapped business, created to support the independent business ecosystem. Our mission is to help independent businesses speak to their engaged target market through the influence of newsletter creators. Transparent sponsorship rates, direct messaging and payments via the platform are just some of the ways we're simplifying the process to make it more accessible for all.",Simon Bruce,https://twitter.com/hecto_io,admin@hecto.io,CPM ranges from $15 CPM to $250 CPM,
Rejoicy,https://rejoicy.com/,Rejoicy.jpg (https://dl.airtable.com/.attachments/8cd8f6797010f79a92a2223dda47f57c/de87a351/Rejoicy.jpg),Sell products to your local community or anywhere through your own e-commerce storefront and the Rejoicy marketplace.,$0.5M,2021,"Bentonville, AR",Worldwide,Ecommerce,SMB (creation of a business),No,Yes,Yes,,"Computer (with internet connection),Smartphone (with data)",Product to sell,30 - 13000,7,158,Other,,Free to create a storefront and list product. 5% per purchase or $35/mo,,"The Rejoicy platform was built to bring the joy back into small business ownership while encouraging shoppers to be excited to support local businesses. With our online marketplace, business owners can expand their reach, allowing community members to discover products and services from home. We want to connect local business owners, shoppers, and the overall community to catalyze not only small businesses but the local economy!",Edwin Ortiz,https://www.linkedin.com/in/edwinortizba/,edwin@rejoicy.com,,
Mav Farm,www.mav.farm,mavfarm-07.jpg (https://dl.airtable.com/.attachments/6f14f03503ce6ce1cba818e98d2a5cf7/0e7e0036/mavfarm-07.jpg),"Mav Farm is a platform that allows you to earn by creating, collaborating, and sharing video that sells your or other brands' products.",$5.1M,2016,Los Angeles,Worldwide,"Ecommerce,Content Creator,Livestreamer",Creator (monetize audience and fans),No,Yes,Yes,12,"Computer (with internet connection),Smartphone (with data)",,1000,1,30,Free,,,,"At Mav Farm, we believe that art, like information, has to be free. Our ecosystem bridges the gap between art, media, commerce, and intelligence and enables creators to build stronger and direct relationships with their audience and business collaborations. There are over 600k users watching and shopping from over 500 of their favorite creators, cultural influencers, and brands. Not only is Mav Farm helping creators and brands earn more for their creative efforts, it is also helping their audiences find new people and stories to engage with in unique and uncompromising ways.",Mateo Moreno,https://twitter.com/itscalamaritime,mateo@mav.farm,,
Questo,questoapp.com,Logo@1x.png (https://dl.airtable.com/.attachments/a1a42b2a39ac136ab92e6bf8b9c6e458/e04277f2/Logo1x.png),Earn a passive income by creating city exploration games based on storytelling. Help people discover new places and stories by playing quests and solving riddles.,$0.6M,2017,"Bucharest, Romania",Worldwide,Content Creator,Creator (monetize audience and fans),No,Yes,No,18,"Computer (with internet connection),Bank Account",Writing experience,500,60,75,Percentage Take Rate,20,,,Questo is a platform for city exploration games available in +100 cities worldwide. More than 100k people have already played with Questo while exploring the quests created by our global network of creators.,Alex Govoreanu,https://twitter.com/AlexGovoreanu,alex@questoapp.com,,
Object Limited,https://object.limited/,logo.png (https://dl.airtable.com/.attachments/85ccad31bf6dfd0728359203b0fbca89/758314f6/logo.png),Sell vintage clothes.,Undisclosed,2018,New York,"North America, Europe, Australia",Reseller,SMB (creation of a business),No,No,Yes,0,"Smartphone (with data),Bank Account",Clothes to sell,500,1,5000,Percentage Take Rate,15,,,,,,annazgray@gmail.com,,
Storetasker,https://www.storetasker.com,storetasker icon - square - white.png (https://dl.airtable.com/.attachments/68426c22c93ca40e312e393b30f65dca/afe43fe7/storetaskericon-square-white.png),"Help Shopify brands design, develop, and market their online business.",$2.8M,2016,"Brooklyn, New York",Worldwide,"Ecommerce,Tasks and Services","Project-based / Freelance services (e.g. Fiverr, Upwork)",No,Yes,Yes,18,"Computer (with internet connection),Bank Account,Background Check",Expert knowledge of Shopify and website development is needed.,5000,3,250,Other,,Project based pricing where 75-90% of the revenue goes to the Expert freelancer.,,,,,bobby@storetasker.com,,
Expat Mentors,https://expatmentors.io/,"2.png (https://dl.airtable.com/.attachments/c6146e731f7766941c03f1b4571a3331/f2938f2a/2.png),1.png (https://dl.airtable.com/.attachments/087718994ae1b4e98beea171e8d06cef/5b6a52a4/1.png)","Expat Mentors is the #1 mentorship platform for international lifestyle advice catering to ex-pats, global-minded founders, and mobile lifestyle seeking professionals.
Mentors can offer the a round of a light consultation and get paid for their advice or opt-in for 1:1 monthly coaching packages - offering a price at their own terms and time commitment.",Bootstrapped,2021,United Kingdom,Worldwide,"Coach,Tasks and Services",Gig (work on your time),No,Yes,Yes,,"Computer (with internet connection),Microphone",Expat experience,500,,,,,,,,,,mareike.popp@gmail.com,,
Steady,steadyhq.com,icon in circle_purple.png (https://dl.airtable.com/.attachments/8ec08ebdd70af4fbc97d640c918792bb/56711e1d/iconincircle_purple.png),"Journalists, media makers, and content creators offer memberships to earn a sustainable income for their work through their communities.",Undisclosed,2016,"Berlin, Germany",Europe,"Audio Content Creator,Content Creator,Writer",Creator (monetize audience and fans),Yes,No,Yes,18,Computer (with internet connection),Regularly publish content,,1,1100,Percentage Take Rate,10,,,,,,manuel.kronenberg@steadyhq.com,,
Postal App,https://www.postalapp.io,postal logo transparent1.png (https://dl.airtable.com/.attachments/49497078795bbe2079176fe562aab710/b68bdc2f/postallogotransparent1.png),"Use Postal to add a paywall to your email. Make unknown senders pay a fee to reach your inbox. Put a price on your attention!
With Postal you can mentor people, monetize your expertise, give feedback, collaborate with people, etc. for your own Price.",$0.05M,2020,"Lewes, Delaware","North America, Europe, Australia, Asia","Coach,Content Creator,Writer",Creator (monetize audience and fans),Yes,No,Yes,18,"Computer (with internet connection),Smartphone (with data),Bank Account",,,,10,Percentage Take Rate,5,,,"Postal liberates your inbox. You no longer have to fear sharing your email address. Postal adds a paywall to your inbox. Great things happen when you are easily reachable - you can mentor people, monetize your knowledge, give feedback, collaborate with people, etc. for your own Price!",Ranjith Parasuraman,https://www.linkedin.com/in/ranjithajay/](https://www.linkedin.com/in/ranjithajay/,hello@postalapp.io,,
SuperChef,https://super-chef.co/?utm_source=sidehustlestack&utm_medium=email&utm_campaign=SideHustleStack,superchef-logo-carré.jpg (https://dl.airtable.com/.attachments/9583a7ff3bf03d374f0544a83a1ae065/dfc38b60/superchef-logo-carre.jpg),Where top chefs leverage their superpowers: provide live cooking classes.,Currently Raising,2020,"London, UK","North America, Europe, Australia, Asia",Chef,Creator (monetize audience and fans),Yes,Yes,Yes,18,"Computer (with internet connection),Bank Account","No specific qualifications, just creative talent, and willpower",6400,1,50,Percentage Take Rate,13,,https://super-chef.co/chefs?utm_source=sidehustlestack&utm_medium=email&utm_campaign=SideHustleStack,,,,florent@super-chef.co,,
Musetown,muse.town,,Get matched with brands you like and create a brand story in your content that your fans would find fun and useful.,Undisclosed,2018,Bay Area,North America,Content Creator,Creator (monetize audience and fans),Yes,Yes,Yes,,Computer (with internet connection),Creativity and a PayPal account,,60,2500,Free,,,,Musetown is a platform where brands and creators work together to create fun and useful content for people. We bring both creative and financially rewarding opportunities to creators and support their creative journey while allowing brands to create brand stories with creators.,Sungho Lee,,sungho@muse.town,~$750/video (but depends largely on size of creator audience),
SamCart,https://www.samcart.com/,SamCartlogo.jpg (https://dl.airtable.com/.attachments/4ee0c804bd77c81af5a9059fb0509b5c/591c19cf/SamCartlogo.jpg),"Create beautiful sites that showcase + sell your online courses, digital or physical products, services, and more. ",$13M,2014,"Austin, TX",Worldwide,"Content Creator,Ecommerce",SMB (creation of a business),No,No,Yes,,Computer (with internet connection),,,,14000,Subscription Fee,49,,,,,,aschmidt@samcart.com,,
inSTREAMLY,https://instreamly.com/streamers/,"logo-full-dark.png (https://dl.airtable.com/.attachments/9b1f3259492872cea8f74e596790bd30/d37d4344/logo-full-dark.png),ins na discrd.png (https://dl.airtable.com/.attachments/5f6e9d76463a06704c2b87bd264396ed/559b9198/insnadiscrd.png)",Monetize your live stream through micro-sponsorships with top brands.,Currently Raising,2019,"Warsaw, Poland",Worldwide,"Gamer,Livestreamer",Creator (monetize audience and fans),No,No,Yes,,Computer (with internet connection),Anything you need to livestream,100,0,2000,Free,,,https://streamer.instreamly.com/register/referral?streamer=sidehustlestack,"Until now only the biggest streamers were able to get sponsored by major brands. With inSTREAMLY technology, we democratize the world of live streaming sponsorships and bring opportunities that were previously reserved to the top 0.01% to all streamers. ",Wiktoria Wójcik,https://twitter.com/vikivojcik,wiktoria.wojcik@instreamly.com,,
AppSumo Marketplace,https://appsumo.com,appsumo-logo.svg (https://dl.airtable.com/.attachments/284e3831422b0120e0883ab744c55a9b/143bf98d/appsumo-logo.svg),"Spotlight your best online courses, downloadable content, and apps to millions of everyday entrepreneurs on the AppSumo Marketplace, a collaborative digital market where creators and business owners thrive.",Bootstrapped,2010,"Austin, TX",Worldwide,"Ecommerce,Content Creator,Writer",Creator (monetize audience and fans),Yes,Yes,Yes,,Computer (with internet connection),"SaaS, course, ebook, PDF, or template library to promote",2000,60,540,Other,,It is free to list on the AppSumo Marketplace. Earn 95% of revenue when you bring a new buyer to AppSumo. Earn 70% from returning customers we bring to you.,,,,,julie@julierichter.co,,
Clicks Talent,clickstalent.com,transparent png.png (https://dl.airtable.com/.attachments/331241bfd3e54b0dee3d6999c539e979/2da549b5/transparentpng.png),"Join our client's live-streaming and short video platforms. Get paid per hours streamed, per videos uploaded, as well as get sponsorships for Instagram and TikTok. We handle payment and issues to ensure your experience is the best it can be while streaming.",Bootstrapped,2017,"Los Angeles, California","North America, Europe, Australia","Livestreamer,Content Creator",Creator (monetize audience and fans),No,Yes,Yes,16,Smartphone (with data),,1000,30,250,Free,,,,,,,ab@clickstalent.com,,
Panion,https://panion.com,Panion new-logo_flag_and_words_2020.png (https://dl.airtable.com/.attachments/0fa6f70afeb35b939b19147252c8b09b/c669c7be/Panionnew-logo_flag_and_words_2020.png),"Build a human-centric community experience through shared content, discussions, memberships, and events, directly into your website.",$0.6M,2018,"Malmö, Sweden",Worldwide,"Community Leader,Event Organizer",Creator (monetize audience and fans),Yes,No,Yes,,"Computer (with internet connection),Smartphone (with data)",Community management knowledge is a plus but not required,500,,25,Free,,,,"Our all-in-one solution allows you to build, grow and engage your community without having to juggle multiple tools. We provide a platform for your members to get to know each other on a deeper level and a host of features to facilitate communication, event management, member matchmaking, and mentorship. With our powerful analytics dashboard, we help you better understand the wants and needs of your community so you can make informed decisions that drive engagement and member satisfaction.",Melanie Aronson,https://twitter.com/melaniearonson,melanie@panion.com,,
City Shoppe,www.cityshoppe.com,CityShoppe_Logo_Main_Color.png (https://dl.airtable.com/.attachments/c1c6cc01ab6e4612346dd66b8fdfe2e9/7175ae4f/CityShoppe_Logo_Main_Color.png),Sell your local products to a global marketplace.,$0.1M,2019,"Portland, OR",North America,Ecommerce,SMB (creation of a business),No,Yes,Yes,,Computer (with internet connection),"SMB owner with a shop in Oregon, Seattle, NYC, LA, Nashville, Austin or Detroit",5000,,150,Other,,,,"As a former SMB owner, I experienced firsthand and grew frustrated with the impact tech giants control over our purchasing and the human, economic, and environmental cost of that control. Because of that, I created City Shoppe. We're dedicated to helping small businesses and retail survive, solving two problems that all local SMBs face: getting discovered and growing your business.

City Shoppe plans to change the way the world sees e-commerce, local shopping, how we value our community through the way we spend our dollars and time, and the support we give to the people behind the products we buy. Allowing businesses to be presented on the site for who they are, not just what they sell. We're creating an immersive experience that brings in each local city's ‘vibe’ and makes users feel like they are visiting somewhere, not just sorting products. ",Ash,,ash@cityshoppe.com,,
Plink,plinkhq.com,plink-word-and-logo-mark.jpg (https://dl.airtable.com/.attachments/a0a2c90897331971ea780cc7397dba35/13e9bf9f/plink-word-and-logo-mark.jpg),Plink makes smart podcast links that creators love and listeners deserve.,Bootstrapped,2019,"Missoula, MT",Worldwide,"Audio Content Creator,Podcaster",Creator (monetize audience and fans),No,No,Yes,,"Microphone,Smartphone (with data),Computer (with internet connection)","Podcast/audio content to promote,Some marketing and affiliate linking knowledge may be helpful",,1,150,Other,,Pro plan at $39/year or custom business pricing,,,,,scott@plinkhq.com,,
ReGlamed,ReGlamed.com,E071E934-97B7-4B2A-B829-920BD065717B.jpeg (https://dl.airtable.com/.attachments/0ac656bd707f5e4b491380f659ca57c7/28be1e3f/E071E934-97B7-4B2A-B829-920BD065717B.jpeg),"Earn cash for your formal dresses for including prom, pageant, balls, gala dresses, and more. ",Bootstrapped,2020,"Jacksonville, FL",North America,Reseller,SMB (creation of a business),No,No,Yes,,Computer (with internet connection),"PayPal account,Clothes to sell",,,100,Percentage Take Rate,10,,,"ReGlamed is a go to site for formalwear for events such as proms, pageants, galas, balls, formal weddings, formal art shows, tea parties, and more. I like to describe ReGlamed as a smart way to Recycle and Rebuy formal dresses and improve the environment from fashion pollution. ",Shamara Sloan,https://twitter.com/RGlamed,shamarasloan@gmail.com,,
GoShare,https://goshare.co,colorstackedFinal_Logos_GoShare_RGB.jpg (https://dl.airtable.com/.attachments/e5d7ced3abe446b4926e5d3a52fd90d4/b447e395/colorstackedFinal_Logos_GoShare_RGB.jpg),"Use your car, pickup truck, cargo van, or box truck to deliver items for businesses and individuals. ",Currently Raising,2015,"San Diego, CA",North America,"Driver,Tasks and Services",Gig (work on your time),No,Yes,No,18,"Car,Bank Account,Background Check","Vehicle less than 15 years old,Pass a Vehicle Inspection,Moving blankets, hand truck, and ratchet straps suggested (optional)",8000,1,8000,Other,,"You provide your own background check, or we can arrange for you to take one at a pass-through cost of $45.",,"I created GoShare first and foremost as an economic empowerment platform. GoShare’s technology enables thousands of entrepreneurs to manage their delivery business while providing critical delivery services to their local communities. GoShare provides a steady stream of deliveries, useful software tools, customer support, and supplemental cargo insurance for delivery professionals. I was the first delivery professional on our platform, so I know how hard our drivers work and how valuable their time is. This is a tool for them, with the goal of helping them be successful. ",Shaun Savage,https://twitter.com/goshare,melinda@goshare.co,,
Craftsman Creative,craftsmancreative.co,Craftsman Creative Logo Only.png (https://dl.airtable.com/.attachments/a394a935cfed7c5ad7b7a4406849fe61/69127ccc/CraftsmanCreativeLogoOnly.png),"Craftsman Creative helps influencers and educators serve their super fans through online courses. We create all of the courses for no up-front cost and do a simple split on the backend, help with launch and marketing, so the course creators have a new asset they can monetize.",Bootstrapped,2020,"Provo, Utah, USA","North America, Europe, Australia",Video Course Creator,Creator (monetize audience and fans),Yes,Yes,Yes,,"Computer (with internet connection),Smartphone (with data),Bank Account,Native English Speaker","10,000 followers/subscribers is our minimum on the site.",1500,30,11,Percentage Take Rate,50,,,"Our goal at Craftsman Creative is to help creatives better serve their audiences through online courses. We align with the creators to ensure that the courses reach as large an audience as possible so that they can grow their reach, influence, and their business.",Daren Smith,https://twitter.com/darentsmith,daren@craftsmancreative.co,,
clubba inc,https://getclubba.com,clubba 2400_1015.optionblueorgangetransparent.png (https://dl.airtable.com/.attachments/95bb3f03b78660b4186fb6b8c79f9982/bfa9418d/clubba2400_1015.optionblueorgangetransparent.png),"Offer virtual after-school clubs for Gen Z kids who want to be creators. We hire college students to be part of the passion economy and lead virtual clubs for kids. Themes include: fashionista, YouTuber video-making, photoshop editing, iPhone photography, and more.",$0.15M,2020,"Atlanta, GA",Worldwide,"Video Course Creator,Teacher",Creator (monetize audience and fans),No,Yes,Yes,18,"Computer (with internet connection),Microphone,Child care experience","Knowledge of field they choose to teach,College student or recent grad",500,3,100,Percentage Take Rate,40,,https://getclubba.com/?utm_source=atelier&utm_medium=affiliate%20link&utm_campaign=atelier%20signup,Clubba is a platform for college students to make money in the passion and creator economy by teaching and exposing kids to new things that expose them to their creative side. Kids learn from students who are doing side hustles in the passion economy. We expose kids to a new type of opportunity and capability in the passion and creator economy. Schools have basic clubs with no true expert leading. We solve this problem by bringing college students with experience into the mix.,Ifrah,,ifrah@getclubba.com,,
Communo,communo.com,CommunoLogo-Vertical-Black.png.png (https://dl.airtable.com/.attachments/0206bafab2c412b947a6a9028a78b72c/a9fbc8ae/CommunoLogo-Vertical-Black.png.png),"Do freelance work in marketing, creative, technology and design related fields for agencies and brands across north America. ",Bootstrapped,2016,"Calgary, AB","North America, Europe, Australia","Tech,Tasks and Services","Project-based / Freelance services (e.g. Fiverr, Upwork)",No,No,Yes,,Computer (with internet connection),"Relevant knowledge/skills in marketing, creative, tech or design fields",2500,45,40000,,,,,,,,patrick@communo.com,,
